{"workspaceSource":{"profile":"openshell-workspace-source-diagnostic/v1","runId":"4ebd51c4ec87ddc964afb37a5c92efba","startedAt":"2026-10-15T22:06:35.501649835Z","finishedAt":"2026-10-15T22:06:36.413100144Z","archiveDigest":"sha256:923eacd2ade97fcaa909d0427e23a1a868f5e7ee1c15f82c476d2207bfc7c613","checks":["cross-domain-denial","source-installation","exact-read-back","substitution-denial","native-source-content","native-source-executable"]},"supervisorCandidate":{"profile":"openshell-supervisor-candidate/v1","sourceCommit":"d556748771c41cbbd4e4dd7cd9030c798afe2b7d","patchSHA256":"5e97724dd9d9e7fad9abed8a46b9a4d6e06979119998c411daf34b2423056057"},"policySource":{"profile":"rosetta-development/v1","compilerSourceCommit":"320158f1e4a4eea378d82c1527f4a7af5fb9855b","inputSHA256":"b2895b9172c50ba7a5fdf574cebdf6789258cc8ce9f90ce5ad8f2b1ff0a825ab"},"candidateCredentialCheck":"passed","schemaVersion":"dataground.dev.openshell-runtime-diagnostic/v6","certificationEligible":false,"profile":{"runtimePolicySHA256":"a1d56c0470c3264c4c37183352d783ebb67911d92ef2eb6ec5f7c76c61f69f39","openshellCommit":"d556748771c41cbbd4e4dd7cd9030c798afe2b7d","gatewayImage":"ghcr.io/nvidia/openshell/gateway@sha256:e21f520a0678ba3cfe749957338b5fa78c75e8e52de13e4559ccbb582f781a0b","supervisorImage":"sha256:57cc182a7c56cf1fbd64af8b09b2196eea727783eb9ec0c2292542e3be0f755c","sandboxImage":"sha256:59a5758504cf6a8e91a4889cde4836a13002d86b6d409e3e1457d7387814393d","runtimeVersion":"0.117.0","runtimeSchemaCanonicalSHA256":"0668eee0081dc5b643ecc7821938ad174f3d532a313a092f387fed3b469876ea","gatewayEndpoint":"http://127.0.0.1:8080","driver":"docker","composeSHA256":"23e7b8fefea1cb51ea3740b6f2c2b9b5a3cd341bbad873e8ace9bb5612c6ad53","gatewayConfigSHA256":"9db5209f411ede9699c58c9e377a1a55958492962f69a3376913eb5210b65983"},"run":{"id":"4ebd51c4ec87ddc964afb37a5c92efba","resources":{"gateway":"dg-runtime-gateway-4ebd51c4ec87ddc964afb37a5c92efba","sandbox":"dg-runtime-sandbox-4ebd51c4ec87ddc964afb37a5c92efba","provider":"dg-runtime-provider-4ebd51c4ec87ddc964afb37a5c92efba","runtime":"dg-runtime-session-4ebd51c4ec87ddc964afb37a5c92efba","workspace":"dg-runtime-4ebd51c4ec87ddc964afb37a5c92efba"},"startedAt":"2026-10-15T22:06:36.413185269Z","finishedAt":"2026-10-15T22:07:24.039499664Z","origin":"local","sourceCommit":"24d922dd9c74e0825453689173df2469bdafa120","model":"gpt-6-astra"},"checks":[{"name":"gateway-ready","status":"passed","startedAt":"2026-10-15T22:06:36.413188311Z","finishedAt":"2026-10-15T22:06:36.413189144Z","observationCommitment":"sha256:a371064f4a5f98d2f7c5f44cda1c196445772197afa82b4885297edfe278dd2f","nativeProtocolExposed":false,"upstreamEndpointExposed":false},{"name":"sandbox-ready","status":"passed","startedAt":"2026-10-15T22:06:36.413196811Z","finishedAt":"2026-10-15T22:06:36.456070582Z","observationCommitment":"sha256:e65e5f9849a2006ec606001bb087430113777645e00ba5c76cf803ec9ad34974","nativeProtocolExposed":false,"upstreamEndpointExposed":false},{"name":"initialize","status":"passed","startedAt":"2026-10-15T22:06:36.456082374Z","finishedAt":"2026-10-15T22:06:36.704757061Z","observationCommitment":"sha256:b84535b187f897eaca29298f726193f7336630100d7c6c9f08f3fb169581d896","nativeProtocolExposed":false,"upstreamEndpointExposed":false},{"name":"turn-success","status":"passed","startedAt":"2026-10-15T22:06:36.704781061Z","finishedAt":"2026-10-15T22:06:59.816545811Z","observationCommitment":"sha256:37ccfd6348c8735ac7f09177dc91264cea9d254d2db7ba1be818522665d2030b","nativeProtocolExposed":false,"upstreamEndpointExposed":false},{"name":"turn-failure","status":"passed","startedAt":"2026-10-15T22:06:59.816593812Z","finishedAt":"2026-10-15T22:07:00.555644374Z","observationCommitment":"sha256:862e7d703eaf5c0be398b47d7d80dcb2cc013ab955afbbee883e53ee7aa783b9","nativeProtocolExposed":false,"upstreamEndpointExposed":false},{"name":"event-normalization","status":"passed","startedAt":"2026-10-15T22:07:00.555694666Z","finishedAt":"2026-10-15T22:07:07.212806097Z","observationCommitment":"sha256:67ae0fb0214f0b7dc1202179cb8f80ba5b9baca1611a58ceccbbf252999a8c30","nativeProtocolExposed":false,"upstreamEndpointExposed":false},{"name":"interrupt","status":"passed","startedAt":"2026-10-15T22:07:07.213055641Z","finishedAt":"2026-10-15T22:07:07.541032221Z","observationCommitment":"sha256:dafefa34612858ebf80c30b12bb91ff68d50cb57576c3efc4577fcec166b7052","nativeProtocolExposed":false,"upstreamEndpointExposed":false},{"name":"cancellation","status":"passed","startedAt":"2026-10-15T22:07:07.541067471Z","finishedAt":"2026-10-15T22:07:07.81687134Z","observationCommitment":"sha256:b6d6e9c65ae23af4da78aef0e8fb25314919a40ef930aeb737299eeb54daf3e6","nativeProtocolExposed":false,"upstreamEndpointExposed":false},{"name":"command-approval","status":"passed","startedAt":"2026-10-15T22:07:07.816897715Z","finishedAt":"2026-10-15T22:07:11.731627758Z","observationCommitment":"sha256:112557059c8dfd58f72164484afedbaefe15088ffc67f41a72426600aafefa0f","nativeProtocolExposed":false,"upstreamEndpointExposed":false},{"name":"file-change-approval","status":"passed","startedAt":"2026-10-15T22:07:11.731693592Z","finishedAt":"2026-10-15T22:07:16.921270433Z","observationCommitment":"sha256:2473eda62eff4ad1fd1f2dd3167fe5da4ac8c76d7ec5dae68aa181133e7a6b2a","nativeProtocolExposed":false,"upstreamEndpointExposed":false},{"name":"artifact-export","status":"passed","startedAt":"2026-10-15T22:07:16.921341975Z","finishedAt":"2026-10-15T22:07:23.939431152Z","observationCommitment":"sha256:133552c90d78eada9c4c2c9f05c853e653795313ac687be398382f53558684ee","nativeProtocolExposed":false,"upstreamEndpointExposed":false},{"name":"sandbox-teardown","status":"passed","startedAt":"2026-10-15T22:07:23.93945386Z","finishedAt":"2026-10-15T22:07:24.027986623Z","observationCommitment":"sha256:fff45acdea8e95ac82bb3d822599faebd8a8829c7a140b3d2c2039bf112b6103","nativeProtocolExposed":false,"upstreamEndpointExposed":false}],"cleanup":{"sandbox":{"name":"dg-runtime-sandbox-4ebd51c4ec87ddc964afb37a5c92efba","status":"removed"},"providerBinding":{"name":"dg-runtime-provider-4ebd51c4ec87ddc964afb37a5c92efba","status":"removed"},"workspace":{"name":"dg-runtime-4ebd51c4ec87ddc964afb37a5c92efba","status":"removed"}},"result":"passed"}
